{
  "version": "1.0.0",
  "generated_at": "2026-09-13T02:30:01.913274+00:00",
  "source_commit": "afa2fd8e1672fc6505af9b251e0baf65692a2057",
  "homepage": "https://vidoxlabs.dev/vitools",
  "mcp": "https://mcp.vidoxlabs.dev/vitools",
  "repo": "https://github.com/Vidoxlabs/vitools-public",
  "counts": {
    "skills": 102,
    "agents": 4,
    "archived_vendor": 0
  },
  "items": [
    {
      "id": "skill:agent-compatibility-check",
      "kind": "skill",
      "slug": "agent-compatibility-check",
      "name": "agent-compatibility-check",
      "title": "Agent Compatibility Check",
      "description": "-\n  Run a full compatibility pass on a repository for agent readiness: scanner score, startup path, validation loop, and docs reliability. Use when preparing a repo for agent-assisted development.",
      "summary": "Check repository readiness for agent-assisted development",
      "license": "MIT",
      "origin": "derived",
      "status": "promoted",
      "public": true,
      "category": "eval",
      "tags": [
        "agent",
        "compatibility",
        "readiness",
        "validation",
        "docs"
      ],
      "platforms": [
        "claude-code",
        "cursor",
        "copilot",
        "opencode",
        "generic"
      ],
      "path": "skills/agent-compatibility-check/SKILL.md",
      "html_url": "https://vidoxlabs.dev/vitools/skills/agent-compatibility-check",
      "raw_url": "https://raw.githubusercontent.com/Vidoxlabs/vitools-public/main/skills/agent-compatibility-check/SKILL.md",
      "mcp_uri": "vitools://skill/agent-compatibility-check",
      "install": {
        "generic": "npx skills add vidoxlabs/vitools-public/skills/agent-compatibility-check",
        "claude-code": "/plugin marketplace add Vidoxlabs/vitools-public\n# then enable the skill by name: agent-compatibility-check",
        "cursor": "curl -fsSL https://vidoxlabs.dev/vitools/skills/agent-compatibility-check/raw -o .cursor/skills/agent-compatibility-check/SKILL.md",
        "agent_prompt": "Fetch https://vidoxlabs.dev/vitools/skills/agent-compatibility-check.md and install it as a project skill at skills/agent-compatibility-check/SKILL.md. Follow its Procedure. Do not modify Guardrails."
      },
      "derived_from": [
        {
          "name": "cursor-check-agent-compatibility",
          "license": "Apache-2.0"
        }
      ]
    },
    {
      "id": "skill:autonomous-pipeline",
      "kind": "skill",
      "slug": "autonomous-pipeline",
      "name": "autonomous-pipeline",
      "title": "Autonomous Pipeline",
      "description": "-\n  Run the full autonomous engineering pipeline end-to-end: plan, work, code review, test, commit, push, open PR, watch CI, fix CI until green. Use only when the user explicitly requests hands-off execution.",
      "summary": "Full autonomous engineering pipeline",
      "license": "MIT",
      "origin": "derived",
      "status": "promoted",
      "public": true,
      "category": "automation",
      "tags": [
        "autonomous",
        "pipeline",
        "plan",
        "work",
        "review",
        "ci"
      ],
      "platforms": [
        "claude-code",
        "cursor",
        "copilot",
        "opencode",
        "generic"
      ],
      "path": "skills/autonomous-pipeline/SKILL.md",
      "html_url": "https://vidoxlabs.dev/vitools/skills/autonomous-pipeline",
      "raw_url": "https://raw.githubusercontent.com/Vidoxlabs/vitools-public/main/skills/autonomous-pipeline/SKILL.md",
      "mcp_uri": "vitools://skill/autonomous-pipeline",
      "install": {
        "generic": "npx skills add vidoxlabs/vitools-public/skills/autonomous-pipeline",
        "claude-code": "/plugin marketplace add Vidoxlabs/vitools-public\n# then enable the skill by name: autonomous-pipeline",
        "cursor": "curl -fsSL https://vidoxlabs.dev/vitools/skills/autonomous-pipeline/raw -o .cursor/skills/autonomous-pipeline/SKILL.md",
        "agent_prompt": "Fetch https://vidoxlabs.dev/vitools/skills/autonomous-pipeline.md and install it as a project skill at skills/autonomous-pipeline/SKILL.md. Follow its Procedure. Do not modify Guardrails."
      },
      "derived_from": [
        {
          "name": "compound-engineering-lfg",
          "license": "Apache-2.0"
        }
      ]
    },
    {
      "id": "skill:bigquery-dbt",
      "kind": "skill",
      "slug": "bigquery-dbt",
      "name": "bigquery-dbt",
      "title": "BigQuery dbt",
      "description": "-\n  Use dbt with BigQuery for transformation pipelines. Models, tests, seeds, and snapshots. Use when building or maintaining a dbt project on BigQuery.",
      "summary": "dbt transformation pipelines on BigQuery",
      "license": "MIT",
      "origin": "derived",
      "status": "promoted",
      "public": true,
      "category": "data",
      "tags": [
        "dbt",
        "bigquery",
        "transformations",
        "models",
        "testing"
      ],
      "platforms": [
        "claude-code",
        "cursor",
        "copilot",
        "opencode",
        "generic"
      ],
      "path": "skills/bigquery-dbt/SKILL.md",
      "html_url": "https://vidoxlabs.dev/vitools/skills/bigquery-dbt",
      "raw_url": "https://raw.githubusercontent.com/Vidoxlabs/vitools-public/main/skills/bigquery-dbt/SKILL.md",
      "mcp_uri": "vitools://skill/bigquery-dbt",
      "install": {
        "generic": "npx skills add vidoxlabs/vitools-public/skills/bigquery-dbt",
        "claude-code": "/plugin marketplace add Vidoxlabs/vitools-public\n# then enable the skill by name: bigquery-dbt",
        "cursor": "curl -fsSL https://vidoxlabs.dev/vitools/skills/bigquery-dbt/raw -o .cursor/skills/bigquery-dbt/SKILL.md",
        "agent_prompt": "Fetch https://vidoxlabs.dev/vitools/skills/bigquery-dbt.md and install it as a project skill at skills/bigquery-dbt/SKILL.md. Follow its Procedure. Do not modify Guardrails."
      },
      "derived_from": [
        {
          "name": "dbt-bigquery",
          "license": "Apache-2.0"
        }
      ]
    },
    {
      "id": "skill:bigquery-development",
      "kind": "skill",
      "slug": "bigquery-development",
      "name": "bigquery-development",
      "title": "BigQuery Development",
      "description": "-\n  BigQuery development patterns: query optimization, partitioning, clustering, materialized views, and cost management. Use when writing or optimizing SQL for BigQuery.",
      "summary": "BigQuery query optimization and cost management",
      "license": "MIT",
      "origin": "derived",
      "status": "promoted",
      "public": true,
      "category": "data",
      "tags": [
        "bigquery",
        "sql",
        "partitioning",
        "clustering",
        "cost-optimization"
      ],
      "platforms": [
        "claude-code",
        "cursor",
        "copilot",
        "opencode",
        "generic"
      ],
      "path": "skills/bigquery-development/SKILL.md",
      "html_url": "https://vidoxlabs.dev/vitools/skills/bigquery-development",
      "raw_url": "https://raw.githubusercontent.com/Vidoxlabs/vitools-public/main/skills/bigquery-development/SKILL.md",
      "mcp_uri": "vitools://skill/bigquery-development",
      "install": {
        "generic": "npx skills add vidoxlabs/vitools-public/skills/bigquery-development",
        "claude-code": "/plugin marketplace add Vidoxlabs/vitools-public\n# then enable the skill by name: bigquery-development",
        "cursor": "curl -fsSL https://vidoxlabs.dev/vitools/skills/bigquery-development/raw -o .cursor/skills/bigquery-development/SKILL.md",
        "agent_prompt": "Fetch https://vidoxlabs.dev/vitools/skills/bigquery-development.md and install it as a project skill at skills/bigquery-development/SKILL.md. Follow its Procedure. Do not modify Guardrails."
      },
      "derived_from": [
        {
          "name": "developing-with-bigquery",
          "license": "Apache-2.0"
        }
      ]
    },
    {
      "id": "skill:browser-automation-testing",
      "kind": "skill",
      "slug": "browser-automation-testing",
      "name": "browser-automation-testing",
      "title": "Browser Automation",
      "description": "-\n  Automate web browser interactions through MCP tools or Playwright. Navigate, extract data, fill forms, click buttons, and take screenshots. Use when automating browser workflows.",
      "summary": "Automate browser interactions via MCP or Playwright",
      "license": "MIT",
      "origin": "derived",
      "status": "promoted",
      "public": true,
      "category": "automation",
      "tags": [
        "browser",
        "automation",
        "mcp",
        "playwright",
        "screenshots"
      ],
      "platforms": [
        "claude-code",
        "cursor",
        "copilot",
        "opencode",
        "generic"
      ],
      "path": "skills/browser-automation-testing/SKILL.md",
      "html_url": "https://vidoxlabs.dev/vitools/skills/browser-automation-testing",
      "raw_url": "https://raw.githubusercontent.com/Vidoxlabs/vitools-public/main/skills/browser-automation-testing/SKILL.md",
      "mcp_uri": "vitools://skill/browser-automation-testing",
      "install": {
        "generic": "npx skills add vidoxlabs/vitools-public/skills/browser-automation-testing",
        "claude-code": "/plugin marketplace add Vidoxlabs/vitools-public\n# then enable the skill by name: browser-automation-testing",
        "cursor": "curl -fsSL https://vidoxlabs.dev/vitools/skills/browser-automation-testing/raw -o .cursor/skills/browser-automation-testing/SKILL.md",
        "agent_prompt": "Fetch https://vidoxlabs.dev/vitools/skills/browser-automation-testing.md and install it as a project skill at skills/browser-automation-testing/SKILL.md. Follow its Procedure. Do not modify Guardrails."
      },
      "derived_from": [
        {
          "name": "cursor-browser-automation",
          "license": "Apache-2.0"
        }
      ]
    },
    {
      "id": "skill:browser-testing",
      "kind": "skill",